{"$schema":"https://json-schema.org/draft/2020-12/schema","type":"object","required":["schema_version","split_id","smoke","calibration","validation"],"properties":{"schema_version":{"const":"native-calibration-split/1.0"},"split_id":{"type":"string"},"calibration_timestamp":{"type":"string"},"smoke":{"type":"array"},"calibration":{"type":"array","minItems":1},"validation":{"type":"array","minItems":1}},"additionalProperties":false}
